{
  "$schema": "https://json-schema.org/draft/2020-12/schema",
  "$id": "https://adop.internal/contracts/v1/silver_spec.schema.json",
  "title": "Silver Transform Spec",
  "description": "Defines Bronze-to-Silver transformation: dedup, nulls, casting, PII masking, quality threshold.",
  "type": "object",
  "required": [
    "dataset_name",
    "schema_version",
    "source_table",
    "primary_key",
    "dedup_strategy",
    "quality_threshold",
    "iceberg_database",
    "iceberg_table"
  ],
  "allOf": [
    {
      "if": {
        "properties": {
          "dedup_strategy": {
            "enum": [
              "keep_latest",
              "keep_first"
            ]
          }
        },
        "required": [
          "dedup_strategy"
        ]
      },
      "then": {
        "required": [
          "dedup_order_by"
        ],
        "$comment": "Without dedup_order_by the template falls back to orderBy(monotonically_increasing_id()), which is neither 'latest' nor stable across runs \u2014 it would silently break both the human's stated intent and transformation idempotency."
      }
    },
    {
      "if": {
        "properties": {
          "dedup_strategy": {
            "const": "drop_exact_duplicates_only"
          }
        },
        "required": [
          "dedup_strategy"
        ]
      },
      "then": {
        "required": [
          "quarantine"
        ],
        "$comment": "drop_exact_duplicates_only routes PK collisions that are not byte-identical to quarantine. Without a quarantine block there is nowhere to put them, and the template would have to choose between dropping a conflicting row silently and failing the run."
      }
    }
  ],
  "additionalProperties": false,
  "properties": {
    "dataset_name": {
      "type": "string",
      "pattern": "^[a-z][a-z0-9_]{1,40}$"
    },
    "schema_version": {
      "type": "string",
      "const": "v1"
    },
    "source_table": {
      "type": "string",
      "minLength": 1,
      "description": "Bronze table or path to read from"
    },
    "primary_key": {
      "type": "array",
      "items": {
        "type": "string",
        "pattern": "^[a-z][a-z0-9_]*$"
      },
      "minItems": 1,
      "description": "Columns defining uniqueness"
    },
    "dedup_strategy": {
      "type": "string",
      "enum": [
        "keep_latest",
        "keep_first",
        "drop_exact_duplicates_only",
        "none"
      ],
      "description": "How to handle duplicate records. keep_latest/keep_first collapse rows sharing a primary key, choosing by dedup_order_by. drop_exact_duplicates_only removes byte-identical rows and routes rows that share a PK but differ in content to quarantine, so a real conflict is surfaced rather than silently resolved."
    },
    "dedup_order_by": {
      "type": "string",
      "pattern": "^[a-z][a-z0-9_]*$",
      "description": "Column to order by when dedup_strategy is keep_latest or keep_first"
    },
    "null_handling": {
      "type": "object",
      "additionalProperties": false,
      "properties": {
        "strategy": {
          "type": "string",
          "enum": [
            "drop_row",
            "fill_default",
            "quarantine",
            "allow"
          ]
        },
        "critical_columns": {
          "type": "array",
          "items": {
            "type": "string",
            "pattern": "^[a-z][a-z0-9_]*$"
          },
          "description": "Columns where null is never acceptable"
        },
        "fill_values": {
          "type": "object",
          "additionalProperties": {
            "type": [
              "string",
              "number",
              "boolean"
            ]
          },
          "description": "Column-name to default-value mapping"
        }
      }
    },
    "transformations": {
      "type": "array",
      "items": {
        "type": "object",
        "required": [
          "type",
          "column"
        ],
        "additionalProperties": false,
        "properties": {
          "type": {
            "type": "string",
            "enum": [
              "cast",
              "rename",
              "derive",
              "mask",
              "validate",
              "trim",
              "lower",
              "upper",
              "split",
              "concat"
            ]
          },
          "column": {
            "type": "string"
          },
          "params": {
            "type": "object",
            "additionalProperties": true
          }
        }
      },
      "default": []
    },
    "type_casts": {
      "type": "array",
      "items": {
        "type": "object",
        "required": [
          "column",
          "from_type",
          "to_type"
        ],
        "additionalProperties": false,
        "properties": {
          "column": {
            "type": "string",
            "pattern": "^[a-z][a-z0-9_]*$"
          },
          "from_type": {
            "type": "string"
          },
          "to_type": {
            "type": "string"
          },
          "format": {
            "type": "string"
          },
          "params": {
            "type": "object",
            "additionalProperties": true
          },
          "on_error": {
            "type": "string",
            "enum": [
              "null",
              "quarantine",
              "fail"
            ],
            "default": "null"
          }
        }
      },
      "default": []
    },
    "pii_masking": {
      "type": "object",
      "additionalProperties": false,
      "properties": {
        "enabled": {
          "type": "boolean",
          "default": false
        },
        "columns": {
          "type": "array",
          "items": {
            "type": "object",
            "required": [
              "name",
              "method"
            ],
            "additionalProperties": false,
            "properties": {
              "name": {
                "type": "string",
                "pattern": "^[a-z][a-z0-9_]*$"
              },
              "method": {
                "type": "string",
                "enum": [
                  "hash",
                  "hash_salted",
                  "mask_partial",
                  "redact",
                  "tokenize",
                  "encrypt"
                ],
                "description": "hash is an unsalted SHA-256 digest: adequate for a high-cardinality value, but trivially reversible by exhaustive enumeration over a small domain \u2014 a date of birth is ~40k candidates. Use hash_salted for any low-cardinality identifier."
              },
              "salt_secret_id": {
                "type": "string",
                "minLength": 1,
                "description": "AWS Secrets Manager secret ID holding the salt. Required when method is hash_salted. The ID, never the secret value \u2014 AGENTS.md security rule 1."
              },
              "target_column": {
                "type": "string",
                "pattern": "^[a-z][a-z0-9_]*$",
                "description": "Output column for tokenized values. Required when method is tokenize."
              },
              "token_secret_id": {
                "type": "string",
                "minLength": 1,
                "description": "AWS Secrets Manager secret ID holding the tokenization key. Required when method is tokenize; only the secret ID is stored in the spec."
              }
            },
            "allOf": [
              {
                "if": {
                  "properties": {
                    "method": {
                      "const": "hash_salted"
                    }
                  },
                  "required": [
                    "method"
                  ]
                },
                "then": {
                  "required": [
                    "salt_secret_id"
                  ],
                  "$comment": "Without a salt source, hash_salted would silently degrade to hash, which is the exact failure this value exists to prevent: the spec would claim a salted digest while the pipeline emitted an enumerable one."
                }
              },
              {
                "if": {
                  "properties": {
                    "method": {
                      "const": "tokenize"
                    }
                  },
                  "required": [
                    "method"
                  ]
                },
                "then": {
                  "required": [
                    "target_column",
                    "token_secret_id"
                  ],
                  "$comment": "Tokenization must be keyed at runtime and must name the output column. A missing key or target must fail validation rather than emit PAN or silently hash in place."
                }
              }
            ]
          }
        }
      }
    },
    "quality_threshold": {
      "type": "number",
      "minimum": 0.8,
      "maximum": 1.0,
      "description": "Minimum quality score to pass Silver gate"
    },
    "iceberg_partition_spec": {
      "type": "array",
      "items": {
        "type": "string",
        "pattern": "^[a-z][a-z0-9_]*$"
      },
      "default": [],
      "description": "Iceberg partition columns for Silver table"
    },
    "iceberg_database": {
      "type": "string",
      "pattern": "^[a-z][a-z0-9_]*$",
      "description": "Glue catalog database name"
    },
    "iceberg_table": {
      "type": "string",
      "pattern": "^[a-z][a-z0-9_]*$",
      "description": "Target Iceberg table name"
    },
    "publish_via_gate": {
      "type": "boolean",
      "default": false,
      "description": "When true this template writes to {iceberg_table}_staging instead of the real table, leaving publication to the quality gate. iceberg_table stays the real name so semantic.yaml, the LF-Tag grants and gold_spec.source_table keep pointing at it. Requires gate_before_publish on the workload's quality_spec and PROMOTE_TO on the quality task -- without both, the data is staged and never published."
    },
    "quarantine": {
      "type": "object",
      "additionalProperties": false,
      "properties": {
        "enabled": {
          "type": "boolean",
          "default": false
        },
        "location": {
          "type": "string"
        },
        "retention_days": {
          "type": "integer",
          "minimum": 1
        }
      },
      "$comment": "location is required when enabled, or the rows have nowhere to go. retention_days is declarative today: no template or spec field applies an S3 lifecycle rule (finding L6).",
      "allOf": [
        {
          "if": {
            "properties": {
              "enabled": {
                "const": true
              }
            },
            "required": [
              "enabled"
            ]
          },
          "then": {
            "required": [
              "location"
            ]
          }
        }
      ]
    },
    "pre_pii_derived_columns": {
      "type": "array",
      "items": {
        "type": "object",
        "required": [
          "name",
          "expression"
        ],
        "additionalProperties": false,
        "properties": {
          "name": {
            "type": "string",
            "pattern": "^[a-z][a-z0-9_]*$"
          },
          "expression": {
            "type": "string",
            "minLength": 1,
            "description": "Spark SQL expression (passed to F.expr) computed BEFORE pii_masking."
          },
          "description": {
            "type": "string"
          }
        }
      },
      "default": [],
      "description": "Columns derived from raw inputs before PII masking (e.g., extract email_domain before email is hashed)."
    },
    "derived_columns": {
      "type": "array",
      "items": {
        "type": "object",
        "required": [
          "name",
          "expression"
        ],
        "additionalProperties": false,
        "properties": {
          "name": {
            "type": "string",
            "pattern": "^[a-z][a-z0-9_]*$"
          },
          "expression": {
            "type": "string",
            "minLength": 1,
            "description": "Spark SQL expression (passed to F.expr) computed AFTER type casts and PII masking."
          },
          "description": {
            "type": "string"
          }
        }
      },
      "default": [],
      "description": "Columns derived from cleansed/masked data (e.g., hours_worked_clean, lawful_basis literals, partition keys)."
    },
    "drop_columns": {
      "type": "array",
      "items": {
        "type": "string",
        "pattern": "^[a-z][a-z0-9_]*$"
      },
      "default": [],
      "description": "Columns to drop from the Silver output (e.g., raw email/full_name after they have been hashed)."
    }
  }
}
